{
  "schema_version": 1,
  "name": "Analytical quadratic-drag fixture",
  "provenance": "Purpose-built analytical fixture",
  "mass_kg": 1200.0,
  "aero": {
    "air_density_kgpm3": 1.225,
    "drag_coefficient": 0.35,
    "lift_coefficient_down": 0.0,
    "reference_area_m2": 2.10
  },
  "powertrain": {
    "maximum_drive_force_n": 0.0,
    "driven_wheel_static_load_fraction": 1.0
  },
  "brakes": {
    "maximum_brake_force_n": 0.0
  },
  "tires": {
    "friction_coefficient": 1.0,
    "rolling_resistance_coefficient": 0.0
  }
}
